,question,answer
91,Why is it important to avoid direct changes to the core logic value?,"Avoiding direct changes to the core logic value when a corresponding setting value is present ensures that the value stored in the core logic and the corresponding setting value are always in sync, preventing inconsistencies."
92,What is the best way to document Python API?,"The best way to document Python API is to use Python Docstring format (Google Python Style Docstring). This involves providing one-liner descriptions, more detailed behavior explanations, Args and Returns sections, all while utilizing Python type hints."
93,What approach should be taken for documenting C++ code that is exposed to Python using pybind11?,"For documenting C++ code exposed to Python via pybind11, the same Google Python Style Docstring format should be used. The pybind11 library automatically generates type information based on C++ types, and py::arg objects must be used to properly name arguments in the function signature."
94,How can Sphinx warnings be dealt with during the documentation process?,"To address Sphinx warnings, it is crucial to fix issues with MyST-parser warnings, docstring syntax, and C++ docstring problems. Properly managing __all__ in Python modules helps control which members are inspected and documented. Also, ensuring consistent indentation and whitespace in docstrings is essential."
95,What are some common sources of docstring syntax warnings?,"Common sources of docstring syntax warnings include indentation or whitespace mismatches in docstrings, improper usage or lack of newlines where required, and usage of asterisks or backticks in C++ docstrings."
96,How can API extensions be added to the automatic-introspection documentation system?,"To add API extensions to the automatic-introspection documentation system, you need to opt-in the extension to the new system. This involves adding the extension to the list of extensions, providing an Overview.md file in the appropriate folder, and adding markdown files to the extension.toml configuration file."
97,Why is it important to properly manage __all__ in Python modules?,"Managing __all__ in Python modules helps control which objects are imported when using 'from module import *' syntax. This improves documentation generation speed, prevents unwanted autosummary stubs, optimizes import-time, unclutters imported namespaces, and reduces duplicate object Sphinx warnings."
98,What is the purpose of the 'deps' section in the extension.toml configuration file?,The 'deps' section in the extension.toml file specifies extension dependencies and links or Sphinx ref-targets to existing projects. It allows the documentation system to resolve type references and generate proper links to other objects that are part of the documentation.
99,How are asterisks and backticks handled in C++ docstrings?,"In C++ docstrings, asterisks and backticks are automatically escaped at docstring-parse time, ensuring that they are properly displayed in the documentation and do not cause any formatting issues."
100,What version of Python does the Kit come with?,Regular CPython 3.7 is used with no modifications.
101,What does Kit do before starting any extension?,Kit initializes the Python interpreter before any extension is started.
102,How can extensions add their own folders to sys.path?,Extensions can add their own folders (or subfolders) to the sys.path using [[python.module]] definitions.
103,What entry point into Python code do extensions get?,"By subclassing as IExt, extensions get an entry point into Python code."
104,What is the recommended method to debug most issues related to Python integration?,Examining sys.path at runtime is the most common way to debug most issues.
105,How can you use a system-level Python installation instead of the embedded Python?,"Override PYTHONHOME, e.g.: --/plugins/carb.scripting-python.plugin/pythonHome=""C:\Users\bob\AppData\Local\Programs\Python\Python310""."
106,How can you use other Python packages like numpy or Pillow?,You can use the omni.kit.piparchive extension that comes bundled with Kit or add them to the search path (sys.path).
107,What is the purpose of the omni.kit.pipapi extension?,The omni.kit.pipapi extension allows installation of modules from the pip package manager at runtime.
108,How can you see all the loaded Python extensions and modules?,You can use the '/python/sys/path' endpoint in the browser to see all the loaded Python extensions and modules.
109,How can you use third-party Python packages that aren't bundled with Kit?,You can use the omni.kit.piparchive extension to install and manage third-party Python packages that aren't bundled with Kit.
110,How can callbacks be bound to context?,Callbacks are wrapped into IEventListener class that allows for context binding to the subscription.
111,What does the IEvent contain?,"IEvent contains event type, sender id, and custom payload, which is stored as carb.dictionary item."
112,What is the recommended way of using event streams?,"The recommended way is through the deferred callbacks mechanisms, unless using immediate callbacks is absolutely necessary."
113,What can be used to narrow/decrease the number of callback invocations?,Event types can be used to narrow/decrease the number of callback invocations.
114,What are the important design choices for event streams?,Either multiple event streams with fairly limited numbers of event types served by each or one single event stream serving many different event types.
115,What is the use of transient subscriptions?,Transient subscriptions are used to implement deferred-action triggered by some event without subscribing on startup and checking the action queue on each callback trigger.
116,How can you execute your code only on Nth event using transient subscriptions?,"The transient subscription can include a simple counter, so you execute your code only on Nth event, not necessarily on the next one."
117,What is the purpose of the carb::events::IEvents Carbonite interface?,The carb::events::IEvents Carbonite interface is used to provide a means to move data around using the generalized interface in a thread-safe manner and synchronize the logic.
118,How are event consumers able to subscribe to callbacks?,"Subscription functions create the ISubscription class, which usually unsubscribes automatically upon destruction."
119,What are some important recommendations for using the events subsystem?,"The events subsystem is flexible, and there are several recommendations intended to help with frequent use-cases and provide clarifications on specific parts of the events logic."
120,What is the carb.events plugin's goal?,The goal of the carb.events plugin is to provide a means to move data around using the generalized interface in a thread-safe manner and also act as a way to synchronize the logic.
121,What happens when events are popped from the event queue?,"When events are popped from the queue one by one or all at once (pump), deferred callbacks are triggered."
122,What is the purpose of this guide?,This guide helps you get started creating new extensions for Kit based apps and sharing them with others.
123,Where was this guide written and tested?,"While this guide can be followed from any Kit based app with a UI, it was written for and tested in Create."
124,Where can I find more comprehensive documentation on extensions?,"For more comprehensive documentation on what an extension is and how it works, refer to the :doc:Extensions (Advanced) <extensions_advanced>."
125,What is the recommended developer environment for extension creation?,Visual Studio Code is recommended as the main developer environment for the best experience.
126,How can I open the Extension Manager UI?,"To open the Extension Manager UI, go to Window -> Extensions."
127,What should I do to create a new extension project?,"To create a new extension project, press the “Plus” button on the top left, select an empty folder to create a project in, and pick an extension name."
128,What is good practice while naming an extension?,It is good practice to match the extension name with a python module that the extension will contain.
129,What happens when I create a new extension project?,"The selected folder will be prepopulated with a new extension, exts subfolder will be automatically added to extension search paths, app subfolder will be linked (symlink) to the location of your Kit based app, and the folder gets opened in Visual Studio Code, configured, and ready for development."
130,What does the “Gear” icon in the UI window do?,"The “Gear” icon opens the extension preferences, where you can see and edit extension search paths."
131,What can I find in the README.md file of the created folder?,The README.md file provides more information on the content of the created folder.
132,How can I observe changes in the new extension after making modifications?,Try changing some python files in the new extension and observe changes immediately after saving. You can create new extensions by cloning an existing one and renaming it.
133,Can I find the newly created extension in the list of extensions?,"Yes, you should be able to find the newly created extension in the list of extensions immediately."
134,What does the omni.kit.app subsystem define?,"The omni.kit.app subsystem defines the minimal set of functionality that Kit Core provides, including loop runner entry point, extension manager, scripting support, general message bus, shutdown sequence management, and hang detector."
135,What are the initial wires an extension gets from the external extension point?,"From the external extension point of view, the only wires that an extension gets initially are just the startup and shutdown functions."
136,What is the role of the loop runner in an application?,"The loop runner drives the application loop, pushing update events into corresponding update event streams and pumping the event streams, allowing modular bits and pieces to tick."
137,What is the default implementation of the loop runner?,"The default loop runner is close to the straightforward implementation outlined in the pseudocode, with small additions of rate limiter logic and other minor pieces of maintenance logic."
138,What does the extension manager control?,"The extension manager controls the extensions execution flow, maintains the extension registry, and handles other related tasks."
139,How can Python scripting be set up and managed?,"The Kit Core app sets up Python scripting environment required to support Python extensions and execute custom Python scripts and code snippets. The IAppScripting interface provides a simple interface to this scripting environment, which can be used to execute files and strings, manage script search folders, and subscribe to the event stream that broadcasts scripting events."
140,What is the purpose of the general message bus?,The general message bus is an event stream that can be used by anyone to send and listen to events. It is useful in cases where event stream ownership is inconvenient or when app-wide events are established that can be used by many consumers across all the extensions.
141,How can an event type be derived from a string hash for the message bus?,An event type can be derived from a string hash using functions like carb.events.type_from_string.
142,How does the application handle shutdown requests?,"The application receives shutdown requests via the post-quit queries. Prior to the real shutdown initiation, the post query event will be injected into the shutdown event stream, and consumers subscribed to the event stream will have a chance to request a shutdown request cancellation. If the shutdown is not cancelled, another event will be injected into the shutdown event stream, indicating that the real shutdown is about to start."
143,What does the app core incorporate to detect hangs?,"The app core incorporates a simple hang detector that receives periodic nudges, and if there are no nudges for some defined amount of time, it will notify the user that a hang is detected and can crash the application if the user chooses."
144,Why is the hang detector helpful?,"The hang detector helps generate crash dumps, allowing developers to understand what happened and what the call stack was at the time of the hang."
145,What are the settings that can be tweaked for the hang detector?,"The timeout, if it is enabled, and other things can be tweaked via the settings."
146,What are some important design choices for event streams?,Either multiple event streams with fairly limited numbers of event types served by each or one single event stream serving many different event types.
147,How can you execute your code only on Nth event using transient subscriptions?,"The transient subscription can include a simple counter, so you execute your code only on Nth event, not necessarily on the next one."
148,What is the purpose of the carb::events::IEvents Carbonite interface?,The carb::events::IEvents Carbonite interface is used to provide a means to move data around using the generalized interface in a thread-safe manner and synchronize the logic.
149,How are event consumers able to subscribe to callbacks?,"Subscription functions create the ISubscription class, which usually unsubscribes automatically upon destruction."
150,What are some important recommendations for using the events subsystem?,"The events subsystem is flexible, and there are several recommendations intended to help with frequent use-cases and provide clarifications on specific parts of the events logic."
151,What is the carb.events plugin's goal?,The goal of the carb.events plugin is to provide a means to move data around using the generalized interface in a thread-safe manner and also act as a way to synchronize the logic.
152,What happens when events are popped from the event queue?,"When events are popped from the queue one by one or all at once (pump), deferred callbacks are triggered."
153,What does the omni.kit.app subsystem define?,"The omni.kit.app subsystem defines the minimal set of functionality that Kit Core provides, including loop runner entry point, extension manager, scripting support, general message bus, shutdown sequence management, and hang detector."
154,What are the initial wires an extension gets from the external extension point?,"From the external extension point of view, the only wires that an extension gets initially are just the startup and shutdown functions."
155,What is the role of the loop runner in an application?,"The loop runner drives the application loop, pushing update events into corresponding update event streams and pumping the event streams, allowing modular bits and pieces to tick."
156,What is the purpose of Omniverse Kit?,"Omniverse Kit is the SDK for building Omniverse applications like Create and View. It brings together major components such as USD/Hydra, Omniverse, Carbonite, Omniverse RTX Renderer, Scripting, and a UI Toolkit (omni.ui)."
157,What can developers use Omniverse Kit for?,Developers can use Omniverse Kit to build their own Omniverse applications or extend and modify existing ones using any combination of its major components.
158,What is USD/Hydra?,"USD is the primary Scene Description used by Kit, both for in-memory/authoring/runtime use and as the serialization format. Hydra allows USD to stream its content to any Renderer with a Hydra Scene Delegate."
159,How can USD be accessed in an extension?,USD can be accessed directly via an external shared library or from Python using USD’s own Python bindings.
160,What is Omni.USD?,"Omni.USD is an API written in C++ that sits on top of USD, Kit’s core, and the OmniClient library. It provides application-related services such as Events/Listeners, Selection handling, access to the Omniverse USD Audio subsystem, and more."
161,What does the Omniverse Client Library do?,The Omniverse Client Library is used by Omniverse clients like Kit to communicate with Omniverse servers and local filesystems when loading and saving assets.
162,What functionality does the Carbonite SDK provide?,"The Carbonite SDK provides core functionality for all Omniverse apps, including plugin management, input handling, file access, persistent settings management, audio support, asset loading and management, thread and task management, image loading, localization, synchronization, and basic windowing."
163,How are Carbonite Plugins implemented?,"Carbonite Plugins are shared libraries with C-style interfaces, and most of them have Python bindings"
