,query,data
172,remote-remapping,"Anyway someone figured out how to remap the Netflix button on the remote, no one watches Netflix that often in America anymore, think it was a poor choice to give it a sole buttonHi Egan,You should post this question in the GeForce Community.
The Shield folks are active in that forum.https://www.nvidia.com/en-us/geforce/forums/shield-tv/9/Thanks,
TomPowered by Discourse, best viewed with JavaScript enabled"
173,computer-vision-solutions-page-refreshed,"Computer Vision Developers:We have updated the Computer Vision Solutions Landing Page, particularly for beginners and those new to NVIDIA software. In short, here are some high-level updates:If you have feedback on the Computer Vision Solutions Landing Page, NVIDIA computer vision software, or anything-related to computer vision, please reach out. Our team would be happy to hear from you.Best,
MikeB_NVPowered by Discourse, best viewed with JavaScript enabled"
174,physx-problems,"Hello I have a GTX 1070TI and a 970 as a Physx graphics card. Wiso only so few games work with my 970? The Games have all PhysX Support.Hello,This is the community feedback board for the developer forums. You should head over to the GeForce forums. There are tons of gaming experts there to help.https://www.nvidia.com/en-us/geforce/forums/discover/Powered by Discourse, best viewed with JavaScript enabled"
175,did-not-leave-enough-time-for-the-final-assessment,"In the Getting Started With Deep Learning I did not need leave enough time for assignment. I am a very slow learner so reading and the assessment may be tricky for me if I have too little time in the Getting Started With Deep Learning course. I also left it on during a phone callI gave you four more hours. Let me know if you have any trouble finishing the course.Cheers,
TomPowered by Discourse, best viewed with JavaScript enabled"
176,cannot-login-to-nvidia-dli,"I am unable to login to DLI.
image1676×212 19.2 KB
Hey,
I have a same problem
After fill my email and password, login page is hang on
Yep. Same.Hi everyone,I have informed the DLI team of this. Please stay tuned for updates.Thanks,
Tom KHi. Sorry about this. A login system update deployed incorrectly. You should be able to log in now.Yep can confirm.Might need to “force refresh” the page though. On chrome, open developer tools, press and hold refresh button, and select “empty cache and hard refresh”.Might need to “force refresh” the page though.Thank you. This is good advice. Ctrl+Shift+R or Cmd+Shift+R may also work, depending on your environment.I am trying to login a course I am tasked with today, (ITU event) and I am stuck in a login loop, unable to proceed.Hey Justinb,
Tried to force reload and DLI return login page

image1462×591 63.4 KB
Update:
I can login DLI successfullyThis topic was automatically closed 14 days after the last reply. New replies are no longer allowed.Powered by Discourse, best viewed with JavaScript enabled"
177,recovery-of-disabled-dli-account,"Hi,I am greeted with the sentence ""Your account has been disabled. If you believe this was done in error, please contact us at "" when I try to login to my DLI account. I’ve emailed the DLI team for help but have not yet heard back. Could you please help me recover my account? Thank you!I remember this happening with one of the DLI demo sessions (I believe it is the MONAI label one) during GTC this year. It was resolved by the DLI team during the seminar. Are these two issues related?Thank you very much!Hi, Welcome to the NVIDIA forums. I have the team looking into this now.Thanks for your patience,
TomHi @ylu.accThis has been fixed. Please try logging in now.Thanks,
TomHi Tom,  Thank you!This topic was automatically closed 14 days after the last reply. New replies are no longer allowed.Powered by Discourse, best viewed with JavaScript enabled"
178,repeated-developer-webinar-registrations-from-scratch,"Hi,
I see many interesting NV webinars on my LinkedIn Homepage but when I attempt to register, I have to provide my details all over again. Can’t this be synced with our Developer Zone account?Hi,Thanks for reaching out. The team is working on a solution to allow for webinar registrations to sync from DevZone accounts. I don’t have an ETA on this, but will post back in this thread when we there is an update.Best,
TomPowered by Discourse, best viewed with JavaScript enabled"
179,feature-request-using-geforce-forums-color-scheme,"As far as I understand GeForce forums and NVIDIA devtalk forums have the same engine, so I’m curious if it’s possible to use GeForce forums color scheme here.Hi Artem,Nvidia chose to make the two forums look completely different on purpose. Also, the Grid forum (Virtual GPU) has the same look as Devtalk. Devtalk users might be happy to hear that we are looking at a total redesign of the Devtalk forums coming sometime in 2019.Best,
TomI’m ok with current design, but I have to say that the green color of links to attachments on grey background makes these almost unreadable to me.Hi HP,As a quick fix, I actually have a ticket open to increase the font size of the attachment links. I will update here when the change has been made.Thanks,
TomHi Tom,Thanks for the quick workaround proposal.
Seems to my eyes that it becomes easily readable with 130% zoom, but probably changing font or background color would be better.
Probably a darker grey background would lead to better contrast.I’m ok with either theme, but picked the lighter theme because for me increased brightness adds to ability to read up close. The brightness on the sides/borders causes the pupils to constrict and increases the depth of focus (I have a separate set of glasses for reading versus driving).On the other hand, I do find a lot about the darker theme I like within the center column where threads are shown (the inner content, not the outer borders). If not for the outer border darkness in the GeForce forums I’d prefer that.A good design allows separating theme from layout so the user can pick a theme, but that’s a lot more work to implement well. If looking at software which already has the choice of picking a color theme which is customizable I’d consider that a plus. If not, I wouldn’t consider it worth waiting for.Hello,The platform vendor just pushed a change to production that increased the font size and changed the background to white.External MediaLooks great, however it would be even better if you showed the Unicode paperclip symbol before the attachment name.Hi Artem,That is another issue altogether. It is on my long list of things that need to be addressed in 2019.Thanks,
TomLooks much better to me :-)
Thanks Tom.Thanks @Honey_Patouceul!@Linuxdev, thanks for the feedback.As I mentioned before, we will be doing a redesign in early 2019.
I promise you all a better user experience.Cheers,
TomPowered by Discourse, best viewed with JavaScript enabled"
180,0x0003,"experienceを起動すると、エラーになり、強制終了していしまいます。
プログラムと機能からアンインストールして、https://www.nvidia.com/ja-jp/geforce/geforce-experience/download/からダウンロードしていますが、最新ヴァージョンをダウンロードすると、再度エラーになります。
原因が不明ですので、解決策があれば、ご教授ください。Hello,Welcome to the NVIDIA Developer forums. For GeForce related questions and issues, please visit the GeForce forums.https://www.nvidia.com/en-us/geforce/forums/discover/Thank you for your guiden1月5日配信されたヴァージョン528.02により、解決しました。This topic was automatically closed 14 days after the last reply. New replies are no longer allowed.Powered by Discourse, best viewed with JavaScript enabled"
181,feature-request-configuring-email-notifications-for-the-topics-you-create-reply-to,"For some reasons the “Receive email notifications when someone replies to your topic” checkbox is always active which might not be what’s suitable for a lot of people here.It would be great if the default state of this checkbox could be made configurable.Thank you.Hi Artem,Thanks for the suggestion. Unfortunately, the community platform does not offer that option at this time.
Look for many improvements to come in 2019.Thanks,
TomPowered by Discourse, best viewed with JavaScript enabled"
182,meaning-of-colours-and-symbols-in-forums-and-posts,"Hello,
why are some posts gray and other green (same for topics)? Also there are different symbols  used.See picture here https://pasteboard.co/IQXLzSE.pngIs there a legenda somewhere?Hello,Gray color posts means that you viewed the thread, Green are new posts. FYI, this forum is very old and will be replaced with a modern platform in the near future.Best,
TomPowered by Discourse, best viewed with JavaScript enabled"
183,unable-to-login-to-developer-server,"I think this has been discussed several times already. Out of the sudden I cannot login to the Developer Server through the Nvidia SDK manager. It opens the browser, I’m logging in (obviously successfully, not using Facebook or Google), the SDK manager opens and after a while I’m getting the information, that my login was not successful.What?Oh cool. NVIDIA SDK Manager | NVIDIA Developer - Error 500 :)Congrats!Hi @foreverneilyoung,Thanks for bringing this to our attention. The issue has been resolved, please let me know if you are still seeing errors.Thanks,
TomWorks now. ThanksPowered by Discourse, best viewed with JavaScript enabled"
184,bug-in-geforce-experience-app,"Здравствуйте,Я обращаюсь к вам с проблемой, связанной с ShadowPlay в GeForce Experience. Я не могу использовать эту функцию ни через горячие клавиши, ни через само приложение. Я попробовал все возможные решения, описанные на вашем сайте и на различных форумах, но ничто не помогло.Я проверил, что моя видеокарта поддерживает ShadowPlay и что я использую последнюю версию GeForce Experience. Я также проверил настройки записи и убедился, что все параметры установлены правильно.Я попробовал выполнить сброс настроек, запускать приложение от имени администратора и проверить наличие конфликтов с другими программами. Однако, эти действия не помогли решить проблему.Я хотел бы получить дополнительную помощь для решения этой проблемы. Пожалуйста, дайте мне знать, как я могу решить эту проблему и снова начать использовать ShadowPlay.Спасибо за вашу помощь.С уважением,
[Юрий]Hello,Welcome to the NVIDIA Developer forums. For GeForce Experience issues please visit the GeForce forums. This community is mainly for developers, data scientists, and others using our non-consumer products and services.https://www.nvidia.com/en-us/geforce/forums/geforce-experience/14/Thanks,
TomThis topic was automatically closed 14 days after the last reply. New replies are no longer allowed.Powered by Discourse, best viewed with JavaScript enabled"
185,need-the-service-of-someone-who-can-program-c-on-gpu,"Hi sorry if this is the wrong place but new to the site.  I need to find someone that can programme C++ on GPU and who can interface via cloud. This is a paid project. Can anyone help or suggest where to look. my email is ar@corvus.comHello,We don’t have a job board here on Devtalk. You might get someone to reply here, but I highly suggest posting something on one of the freelance websites.Best,
TomHi sorry, would be kind enough to give me some names. ThanksUpwork.com comes to mind. Perform a search and see what others come up.Powered by Discourse, best viewed with JavaScript enabled"
186,nvidia-forums-discord-channel,"Hello,There was a nvidia discord channel with topics similar to the Nvidia developer forums. Do any mods have the invite link available? Couldn’t find it anywhere on this website. ThanksHi @cap,Please try this link.Official NVIDIA Developer server, engage with other developers and users of NVIDIA SDKs, APIs, Libraries and Tools. | 1879 membersCheers,
TomPowered by Discourse, best viewed with JavaScript enabled"
187,edit-topic-from-before-migration,"This is an extension to this post by a different user - New forum edit functionalityThe code I posted on a topic I created (a few hours before the forum migration started) is slightly wrong and I want to edit it. The topic in question is - https://forums.developer.nvidia.com/t/extending-hillis-steele-to-multiple-blocks/115419Is there a way to edit it now?Hi Reikdas,Please try to edit now.Thanks,
TomWorks! Thanks.Great!Powered by Discourse, best viewed with JavaScript enabled"
188,attaching-files-to-forum-topics-posts,"Hello,There has been a little confusion about adding attachments to forum topics/comments. Note that you must create and publish your posting before you have the option to upload attachments.The maximum file size allowed is 10MB.DevTalk allows the following file types:(‘avi’,‘bmp’,‘c’,‘chm’,‘cpp’,‘cu’,‘doc’,‘gif’,‘gsl’,‘gz’,‘h’,‘htm’,‘html’,‘ico’,
‘jpeg’,‘jpg’,‘jps’,‘mov’,‘mp3’,‘mpg’,‘pdf’,‘png’,‘pns’,‘ppt’,‘pyg’,‘rar’, ‘rib’,‘rtf’,‘swf’,‘tar’,‘tif’,‘tiff’,‘txt’,‘wav’,‘wmv’,‘xls’,‘xml’,‘zip’,
‘log’,‘xlsx’,‘docx’,‘pptx’,‘7z’)External MediaExternal MediaExternal MediaExternal MediaThat’s all there is to it.Feel free to message me directly if you have any questions or issues with our community platform.Thanks for being part of the Nvidia Developer Community!Powered by Discourse, best viewed with JavaScript enabled"
189,access-to-the-developer-forum-from-ukraine,"Hello,when accessing the forum from Ukraine I see the information about the restricted access based on location.
Can anybody explain what’s going on and why?Powered by Discourse, best viewed with JavaScript enabled"
190,romania,"I’m Roman and I’m sorry. why ?, because I will make an original product and I do not have access to this product. yes I feel discredited compared to other countries. I also want to buy the GEFORCE RTX board
2060 SUPER and I have no choice.Hello,Welcome to the NVIDIA Developer Forums. I suggest posting to the GeForce forums. There may be someone there that can point you to a vendor in your region.https://www.nvidia.com/en-us/geforce/forums/discover/Best regards,
TomPowered by Discourse, best viewed with JavaScript enabled"
191,welcome-message,"Hello,Welcome to the NVIDIA Developer Community. I am very excited to be part of this community and look forward to supporting our developers around the world. This community is here for you to get help, gain knowledge, and share your thoughts and ideas.The NVIDIA team and I are eager to help answer your questions and provide you with information that will help you get the most from our platforms, products, and technologies. We look forward to working with all of you!How to get started:Getting to know the forums: Check out this helpful guide.Participating: You will need to register if you would like to post a question or join a discussion.Exploring: Using the search located in the top right of the page is the fastest way, but feel free to roam around the community.The rules: We have set some guidelines that help keep the community safe and free from spam and malicious content.If you find something wrong, broken or have a suggestion for improvements, please post in this forum or send me a private message.Cheers,
Tom K
NVIDIA Developer Community ManagerPowered by Discourse, best viewed with JavaScript enabled"
192,theming,"One of the things I had an issue with using the old forum was the inability to set themes…Any news on whether the new forum will support themes?Hi gtj,This is something we have discussed in the past. I have it on the list of possible improvements for the next update, but there is no timeline for when/if this will happen.Thanks for the feedback.Best,
TomPowered by Discourse, best viewed with JavaScript enabled"
193,nvidia-driver-early-access,"Is there a program I can register at where I can get early access to unreleased upcoming drivers, so I can verify that my software works correctly with the upcoming drivers?Hello,You can find beta release drivers on the “Driver Download” page here: [url]https://www.nvidia.com/download/find.aspx[/url]Powered by Discourse, best viewed with JavaScript enabled"
194,error-to-upload-files,"I was trying to upload a log file about other question and got this error in Firefox Developer Console. I’m sharing over Dropbox because I can´t upload. Dropbox - Screenshot from 2022-07-27 16-57-04.png - Simplify your lifeHi,Sorry, I am unable to replicate your issue. What is the file type and size that you are trying to upload?Thanks,
Tom K@TomNVIDIA I found the problem. The problem is this extension: https://docs.clearurls.xyz/Would have you any idea why?Unfortunately I do not. It is possible the platform AV scanner is flagging the file.This topic was automatically closed 14 days after the last reply. New replies are no longer allowed.Powered by Discourse, best viewed with JavaScript enabled"
195,usage-limit-in-nvidia-dli,"I have paid for the class named ‘Getting Started with Deep Learning’ but I got the error says ‘Usage Limit’ even though I only used it for a short time to study. and I am not able to continue the class at second lecture. can you give me more time to study and what’s the exact time that I had been provided?Hello @swm-study,Your account has been updated with more time.Cheers,
TomThis topic was automatically closed 14 days after the last reply. New replies are no longer allowed.Powered by Discourse, best viewed with JavaScript enabled"
196,implementation-option-delete-game-geforce-experience,"Hi, I would like you to implement the option to remove from the geforce experience library those games that I do not want to appear and that I authorize directly from the shield tv option.Hello,You are posting in the developer forums. Please visit the Shield TV forum in the GeForce community.https://www.nvidia.com/en-us/geforce/forums/shield-tv/9/Best,
TomPowered by Discourse, best viewed with JavaScript enabled"
197,403-site-forbidden,"Hi, I’ve tried to send a message to support, but I can’t.
[url]https://imgur.com/LSfVf3w[/url]
Please help me with my issue.Best wishesHi Pawel,I am looking for someone to help you. I will get back to you asap.Thanks,
TomI saw that Miles jumped into your original thread.https://devtalk.nvidia.com/default/topic/1042933/building-ue4-with-nvidia-flex-errors/#5290283Thank you for your time. This thread is closed now.Best Wishes,
PawełPowered by Discourse, best viewed with JavaScript enabled"
198,add-expand-collapse-list-to-jetson-download-center,"Hi,
There are many duplicated titles in a long long list of downloads, even a filter has been applied. And most of them are just in different versions.So, showing only one item and collapsing it’s different versions defaultly is helpful to users who want to find info quickly.Such as this:
+ L4T Documentation 32.1 2019/03/18 (latest)When user click “+ L4T Documentation 32.1 2019/03/18 (latest)”, then show asHi @Keelung,Welcome to the NVIDIA Developer forums. Thanks for reaching out. I have sent your suggestion on to the team that manages those pages.Best,
Tom KPowered by Discourse, best viewed with JavaScript enabled"
199,geforcenow-cannot-be-opened-because-of-a-problem,"Check with developer to make sure GeforceNow works with this version of macOS. You may need to reinstall the application. Be sure to install any available updates for the application and macOS.Process:               GeForceNOW [1846]
Path:                  /Applications/GeForceNOW.app/Contents/MacOS/GeForceNOW
Identifier:            com.nvidia.gfnpc.mall
Version:               2.0.12.60 (2.0.12.60)
Code Type:             X86-64 (Native)
Parent Process:        ??? [1]
Responsible:           GeForceNOW [1846]
User ID:               501Date/Time:             2019-09-28 13:44:53.385 -0700
OS Version:            Mac OS X 10.14.6 (18G103)
Report Version:        12
Anonymous UUID:        35D895F8-BCE1-5600-5778-C08A7DBEE7EBTime Awake Since Boot: 1500 secondsSystem Integrity Protection: enabledCrashed Thread:        0Exception Type:        EXC_CRASH (SIGABRT)
Exception Codes:       0x0000000000000000, 0x0000000000000000
Exception Note:        EXC_CORPSE_NOTIFYTermination Reason:    DYLD, [0x1] Library missingApplication Specific Information:
dyld: launch, loading dependent librariesDyld Error Message:
Library not loaded: @executable_path/…/Frameworks/libGeronimo.dylib
Referenced from: /Applications/GeForceNOW.app/Contents/MacOS/GeForceNOW
Reason: image not foundBinary Images:
0x1050b6000 -        0x1051a5ffb +com.nvidia.gfnpc.mall (2.0.12.60 - 2.0.12.60)  /Applications/GeForceNOW.app/Contents/MacOS/GeForceNOW
0x1146fc000 -        0x11476670f  dyld (655.1.1)  /usr/lib/dyld
0x7fff4bad8000 -     0x7fff4c88dffb  com.apple.AppKit (6.9 - 1671.60.109)  /System/Library/Frameworks/AppKit.framework/Versions/C/AppKit
0x7fff4dc4c000 -     0x7fff4dc4cfff  com.apple.Cocoa (6.11 - 23)  /System/Library/Frameworks/Cocoa.framework/Versions/A/Cocoa
0x7fff4df35000 -     0x7fff4dfbbfff  com.apple.audio.CoreAudio (4.3.0 - 4.3.0) <1E8E64E6-0E58-375A-97F7-07CB4EE181AC> /System/Library/Frameworks/CoreAudio.framework/Versions/A/CoreAudio
0x7fff4f5b6000 -     0x7fff4f6bafff  com.apple.CoreMedia (1.0 - 2290.13)  /System/Library/Frameworks/CoreMedia.framework/Versions/A/CoreMedia
0x7fff4f717000 -     0x7fff4f717fff  com.apple.CoreServices (946 - 946) <2EB6117A-6389-311B-95A0-7DE32C5FCFE2> /System/Library/Frameworks/CoreServices.framework/Versions/A/CoreServices
0x7fff50252000 -     0x7fff50292ff3  com.apple.CoreVideo (1.8 - 281.4) <10CF8E52-07E3-382B-8091-2CEEEFFA69B4> /System/Library/Frameworks/CoreVideo.framework/Versions/A/CoreVideo
0x7fff50579000 -     0x7fff5057effb  com.apple.DiskArbitration (2.7 - 2.7)  /System/Library/Frameworks/DiskArbitration.framework/Versions/A/DiskArbitration
0x7fff50dfc000 -     0x7fff50e8bfff  com.apple.framework.IOKit (2.0.2 - 1483.260.4) <8A90F547-86EF-3DFB-92FE-0E2C0376DD84> /System/Library/Frameworks/IOKit.framework/Versions/A/IOKit
0x7fff50e8d000 -     0x7fff50e9cffb  com.apple.IOSurface (255.6.1 - 255.6.1) <85F85EBB-EA59-3A8B-B3EB-7C20F3CC77AE> /System/Library/Frameworks/IOSurface.framework/Versions/A/IOSurface
0x7fff58152000 -     0x7fff58161ffb  com.apple.opengl (17.7.3 - 17.7.3) <94B5CF34-5BD6-3652-9A8C-E9C56E0A9FB4> /System/Library/Frameworks/OpenGL.framework/Versions/A/OpenGL
0x7fff599f1000 -     0x7fff59cf1fff  com.apple.security (7.0 - 58286.270.3.0.1)  /System/Library/Frameworks/Security.framework/Versions/A/Security
0x7fff5a14d000 -     0x7fff5a1bafff  com.apple.SystemConfiguration (1.17 - 1.17) <30C8327F-3EFF-3520-9C50-016F8B6B954F> /System/Library/Frameworks/SystemConfiguration.framework/Versions/A/SystemConfiguration
0x7fff5a419000 -     0x7fff5a77afff  com.apple.VideoToolbox (1.0 - 2290.13) <7FCB2FC0-EFB8-37C2-B0D3-60AE9FDFE230> /System/Library/Frameworks/VideoToolbox.framework/Versions/A/VideoToolbox
0x7fff77439000 -     0x7fff7743affb  libSystem.B.dylib (1252.250.1)  /usr/lib/libSystem.B.dylibModel: MacBookPro11,2, BootROM 156.0.0.0.0, 4 processors, Intel Core i7, 2.5 GHz, 16 GB, SMC 2.18f15
Graphics: kHW_IntelIrisProItem, Intel Iris Pro, spdisplays_builtin
Memory Module: BANK 0/DIMM0, 8 GB, DDR3, 1600 MHz, 0x80AD, 0x484D54343147533641465238412D50422020
Memory Module: BANK 1/DIMM0, 8 GB, DDR3, 1600 MHz, 0x80AD, 0x484D54343147533641465238412D50422020
AirPort: spairport_wireless_card_type_airport_extreme (0x14E4, 0x134), Broadcom BCM43xx 1.0 (7.77.61.2 AirPortDriverBrcmNIC-1305.8)
Bluetooth: Version 6.0.14d3, 3 services, 27 devices, 1 incoming serial ports
Network Service: Wi-Fi, AirPort, en0
Serial ATA Device: APPLE SSD SM0512F, 500.28 GB
USB Device: USB 3.0 Bus
USB Device: Apple Internal Keyboard / Trackpad
USB Device: BRCM20702 Hub
USB Device: Bluetooth USB Host Controller
USB Device: USB 2.0 Hub
USB Device: USB Optical Mouse
USB Device: Saitek Eclipse Keyboard
USB Device: USB 2.0 Camera
USB Device: USB Audio Device
Thunderbolt Bus: MacBook Pro, Apple Inc., 17.1i Updated my macbook pro to 10.14.8 now it says thisPowered by Discourse, best viewed with JavaScript enabled"
200,join-our-gtc-keynote-watch-party-3-21-23,"Hi everyone,Come join us tomorrow at 8 am PDT for the GTC 2023 Keynote watch party on our Discord server. The NVIDIA CEO Jensen Huang will be sharing the AI technologies affecting every industry–and our everyday lives.Official NVIDIA Developer server, engage with other developers and users of NVIDIA SDKs, APIs, Libraries and Tools. | 1,268 membersPowered by Discourse, best viewed with JavaScript enabled"
