,query,data
0,post-is-hidden,"My post
https://devtalk.nvidia.com/default/topic/1047379/unsupported-cuda-driver-version-10010/?offset=1
is hidden.Please make it public.Why is my account blocked like this?Hi,The system blocked your account for some reason. You should be good to go now.Best,
TomSame. Looking for assistance.Hi Jase,Your account has been unblocked.Cheers,
TomHello!
Please unblock my account. My posts are hidden. It really hinders me to work.Sergei@sergey.bilenko, Your account has been unblocked.Best,
TomHello,
I have the same issue (hidden posts), could you resolve it, please.@nickkl,You are good to go.Cheers,
TomI have the same issue, please resolve it, please!Hi plainwu4l4bb,I do not see any other posts created under your name. Can you provide the topic title or URL?Thanks,
TomHijacking this topic, apparently mine got hidden as well https://devtalk.nvidia.com/default/topic/1055743/optix/problem-with-turning-off-rtx-mode-on-gtx-1080/Would be great if someone could unblock me as well.Thanks in advance,
DavidI have the same issue, [url]https://devtalk.nvidia.com/default/topic/1065388/deepstream-sdk/save-output-video-for-deepstream-4-0-1/post/5395061/#5395061[/url]Powered by Discourse, best viewed with JavaScript enabled"
1,unusable-on-mobile,"This website is very nearly completely unusable on mobile. As somebody who is on a mobile device at least half the  day, this is very frustrating. Please use some alternative forum software.Hi mdegans,Thanks for the feedback.
I totally agree with you. This is one of the top issues that I am looking to address in the next redesign.Best,
TomThanks!Powered by Discourse, best viewed with JavaScript enabled"
2,driver-error-471-11,"Hi!When I update to the latest version of the driver my resolution drops to 640 * 480 using displayport.
This problem happened to me in windows 10 and windows 11.Does not recognize the monitor and windows configuration  show:
Desktop mode  640480 60 hz
Active signal mode 640480 60 hz
Bit depth 6-bit
Color format RGB
Color space Standar dynamic range (SDR)The solution I found was to try different versions and with 466.47-desktop-win10-64bit-international-dch-whql it works well
2 - 471.11-desktop-win10-64bit-international-dch-whql780×479 73.3 KB
With 466.47 in  Nvidia Control Panel - Display show well  my two monitors and does not stay with NVIDIA Digital …I doing something wrong or is there a bug in the new drivers?Spec:
2 monitor: Samsung C27f390 x HDMI and Aorus FI27Q DisplayPort.
EVGA GeForce RTX 3080 XC3 ULTRA GAMING
CPU: Intel i7 9700k
MB: Z390 Aorus Ultra
RAM: 32 GB
PW: EVGA 750 GQHi @lcanavesio,Welcome to the NVIDIA Developers forums. This feedback forum is for reporting community related issues and offers no gaming support. This sounds like a consumer issue best posted in the GeForce forums.Get the support you need.Hi @TomNVIDIAI contacted the nvidia support via chat and they solved the problem for me. They created a hot fix of the driver and there my problem was solved  - ""Some displays screen resolution limited to 640x480 after driver update [3330750] ""https://nvidia.custhelp.com/app/answers/detail/a_id/5212I’m super happy to hear that! Thanks for sharing.This topic was automatically closed 60 days after the last reply. New replies are no longer allowed.Powered by Discourse, best viewed with JavaScript enabled"
3,sdk-manager-login-problem,"I have created three different accounts and none of the three have access to the SDK Manager (attached screenshot):Everything You Need to Set Up Your Development Environment NVIDIA SDK Manager provides an end-to-end development environment setup solution for NVIDIA’s DRIVE, Jetson, Holoscan, Rivermax, DOCA and Ethernet Switch SDKs for both host and target...
Screenshot from 2022-05-13 07-40-12987×623 331 KB
I downloaded the latest version NVIDIA SDK Manager 1.8:Everything You Need to Set Up Your Development Environment NVIDIA SDK Manager provides an end-to-end development environment setup solution for NVIDIA’s DRIVE, Jetson, Holoscan, Rivermax, DOCA and Ethernet Switch SDKs for both host and target...Hello,Welcome to the NVIDIA Developer forums. I will have the team look into this and get back to you.Thanks,
Tom KTo help us troubleshoot your issue, can you please share the log files from ~/.nvsdkm folder?Hello @augusto.hernandez.elvira,Are you still having issues?Everything is correct now, I have tried a different Email address.We can close this post…Thank you very much!Happy to hear!Cheers,
Tom KPowered by Discourse, best viewed with JavaScript enabled"
4,welcome-to-our-mellanox-customers,"Hello Mellanox customers,Welcome to the NVIDIA Forums! If this is your first time here, we recommend that you create a new account. Users of the old Mellanox forums will need to create accounts to allow posting. Mellanox users should use the same email address that was used in the old forums, this allows us to link your past activity to your new profile.To register and create your account, please go to https://developer.nvidia.com/ and click “Join”.Once registered, you will have access to the forums. Please read this user guide to learn more about the new platform and features.We hope you like the new forums. Please post your comments or suggestions in the Forum Feedback category.Powered by Discourse, best viewed with JavaScript enabled"
5,teach-me-please-change-the-tdp,"Hello.I am planning to use Geforce3090. How can I change the TDP?Hello,Welcome to the NVIDIA Developer forums. This category is for posting forum platform issues and offers no support. I suggest posting this over in the Geforce forums.https://www.nvidia.com/en-us/geforce/forums/discover/Best,
TomThis topic was automatically closed 14 days after the last reply. New replies are no longer allowed.Powered by Discourse, best viewed with JavaScript enabled"
6,how-can-i-delete-a-topic-or-delete-the-history-of-the-modification,"Hello, I want to delete a topic or delete the history of the modification, I have got some troubles.Hello,Please provide the link to your topic that you wish deleted. I can then take care of this for you.Thanks,
TomI need delete the history information of the one modify onlyI need delete the history information of the one modify onlyJust to be clear, are you asking me to delete the entire original post by you?Thanks,
TomYes, if you can.
Thanks very much.The topic has been deleted.Regards,
TomThis topic was automatically closed 14 days after the last reply. New replies are no longer allowed.Powered by Discourse, best viewed with JavaScript enabled"
7,awesome-job-with-the-new-forums,"I have not been very active here (sorry), asked for help on something recently, just wanted to say the new forum design is awesome – great work with the refresh!  Spent a little while looking around after the post, it’s very fluid / modern.  I do have a bit of nostalgia for the old forums of course, but love what you all did here!If you’re looking for possible areas of improvement (that are by no means any real priority hehe)Hi Stephen,Thanks for the feedback and for being a longtime member. We will certainly consider your suggestions in future platform updates.Best,
TomPowered by Discourse, best viewed with JavaScript enabled"
8,separator-typos-in-sdk-manager-guidelines,"Hi,
As in sdkm docker doc, – - _ are used incorrectly.Such as,

nv_site_191147×747 94.3 KB
And,

nv_site_201517×559 46.9 KB
Sorry for the delay in replying, but this should now be fixed.
Please let me know if any issues persist.ThanksIt’s not fixed. I checked it just now. You can check it again. The URL is in the begening of this thread.I checked it today. It’s fixed now. Thanks!Great! Thanks for the confirmation.There was a cache clear issue on docs.nvidia.com, so it’s updated correctly after cache cleared.This topic was automatically closed 14 days after the last reply. New replies are no longer allowed.Powered by Discourse, best viewed with JavaScript enabled"
9,retraining-trafficcamnet,"Hi. I am interested in re training of trafficcamnet for own data set. can any 1 help me for the same. ThanksHi,Welcome to the NVIDIA Developer forums! You posted in the community feedback section, unfortunately, there is no support in this category. Please tell me what service or product your issue is related to, and I will move your topic there.Thanks,
TomPowered by Discourse, best viewed with JavaScript enabled"
10,sdk-manager-blocked,"Hello,I’m blocked out of the SDK manager and it says to check my mail but I don’t have any messages. Can I please get unblocked?Hello @TylerMG26,Please make sure you are using the latest version of the SDKM.Best regards,
Tom KThis topic was automatically closed 14 days after the last reply. New replies are no longer allowed.Powered by Discourse, best viewed with JavaScript enabled"
11,sdk-manager-locked-and-didn-t-receive-the-mail-to-unlock-it,"Hi.
SDK Manager locked and not get receive the mail to unlock it.SDK Manager login message “The account is blocked. Check your mail to unblock”
Please help.
Thanks.Hi @KatouMegumi,Welcome to the NVIDIA Developer forums. We are looking into your account now, please stand by.Thanks for your patience,
TomThis is fixed. Please try now.Thanks,
TomHi @TomNVIDIANow it works,
Thanks.
KatouPowered by Discourse, best viewed with JavaScript enabled"
12,ghosted-post-about-tdr-crash-fix,"Hello. I have posted a serious post about TDR crash fix and it’s ghosted, can some moderator check it and unghost? Please delete this message after doing that, thanksHi @itd-gaming,Welcome to the NVIDIA Developer forums! Looks like this was resolved.
Let me know if you still have issues with your post.Best,
Tom KThis topic was automatically closed 14 days after the last reply. New replies are no longer allowed.Powered by Discourse, best viewed with JavaScript enabled"
13,usage-limit-error-in-dli,"Dear Nvidia community,
I started with NVIDIA paid Course: "" Getting started with deep learning""
I just finished a third of the material. I can’t start the laboratory now and I get a pop-up window error: "" Usage Limit You have exhausted the lab time provided with your course enrollment.""Course: Getting started with deep LearningWould it be possible to add some extra time to finish the course?Thanks in advance!!Hello,Welcome to the NVIDIA forums! I have granted you additional time, let me know if you have any issues accessing the course.Cheers,
TomHi,Thank you for granting me additional time!I am stuck on the final assessment for the same course and was wondering if you could grant me more time…
The error is the same, "" Usage Limit You have exhausted the lab time provided with your course enrollment.""Course… getting started with deep learningThanks in advance!!Hi, You have two more hours now.Best of luck,
TomThank you so much!!!Powered by Discourse, best viewed with JavaScript enabled"
14,how-to-manage-second-factors,"I have added a hardware key to the account and a Google Authenticator. Is there any panel I can de-register these second factor, or add additional security keys?Hi @matlacki,I have reached out to the systems team for an answer on this. I will get back to you ASAP.Thanks,
Tom KHi @matlacki,This FAQ should help answer your question.loginBest,
Tom KHi,unfortunately there is nothing relevant there. I know what is second factor, I have added it, I understand the benefits, but:The FAQ is extremely basic, at the level of “computer needs to be plugged to mains” for people troubleshooting boot problems.Best,
MateuszIs there any hope for reply?Is there any hope for reply?I have asked the platform team for help with this. Thanks for your patience.All options for second factor authentication can be found at the NVIDIA Profile Portal: https://profile.nvgs.nvidia.comThanks! This is exactly what I was looking for.Awesome! Happy it was helpful.This topic was automatically closed 14 days after the last reply. New replies are no longer allowed.Powered by Discourse, best viewed with JavaScript enabled"
15,duplicate-threads,"At least in the Nano forum there is this:

Screenshot_20200316-0742501440×3040 409 KB
I removed those duplicates.Thanks,
TomThanks!Powered by Discourse, best viewed with JavaScript enabled"
16,mismatch-in-email-ids-between-profile-on-developer-nvidia-com-and-nvidia-com,"Hallo all,I recently updated my email id on my NVIDIA profile and it successfully changed after the standard verification email procedure. Then I expected the same to automatically have happened on my NVIDIA developer profile too, but to my surprise the old email id still remained. I was able to use my new email id to login into that same NVIDIA developer profile though, which doesn’t make sense tbh.I even tried to follow the instructions, but when I click on “edit profile” in the top right, the following page appears instead of whats shown in the instructions.

nvidia_developer_forum_edit_profile1610×894 77.6 KB
So, at the end I gave up and came here to ask for help. Hoping for a solution from any of the developers here.Thank you.Hi @Jayadev,Thanks for reaching out. I will have the systems team look into this and get back to you.Thanks,
Tom KHi @Jayadev,This should now be fixed. Please log out and reauthenticate.Thanks,
Tom KHi,
I’m in the same situation.
Can change the developer mail, but in the forum profile have the old one.Thanks,
A.GrandaHi @alejandro.granda,Please clear your browser cache, then log into DevZone or the developer forums. That should resolve the issue.Best,
Tom KThis topic was automatically closed 14 days after the last reply. New replies are no longer allowed.Powered by Discourse, best viewed with JavaScript enabled"
17,need-some-time-for-the-course-accelerating-end-to-end-data-science-workflows,"I spent much longer than I expected on certain parts and could use some more time to finish the last section and the assessment.Hello,Welcome to the NVIDIA Developer forums! I have extended the time for you.Cheers,
TomHi @cjv224,Did you have any issues accessing the course?Hi,Thanks for your quick response! I am able to access the course but my timer started at 12:50, so I was hoping to receive a few more hours to finish the course because 1 hour will not be enough time.

image.png1176×169 13.3 KB
Best,
ChrisI just added more time. I hope that is enough.Thank you very much!This topic was automatically closed 14 days after the last reply. New replies are no longer allowed.Powered by Discourse, best viewed with JavaScript enabled"
18,nvidia-self-drive-cars-contact-us-form-not-working,"Hi. I’m having some problems using the “Contact Us” form on the Self-Driving Cars page. It looks like a server side issue, but there are no feedback when submitting to the form.
How do I get in contact with the Self-Driving Cars Partner program when the form is not working? I have written Nvidia directly with no answer and chat support tells me that I should try the forum.Autonomous car developers use NVIDIA DRIVE car technology to teach self-driving cars to see, think, and learn. Read moreBrowser console error, when submitting:
https://www.dropbox.com/s/4nnw4x8ttriw5gy/nivida_contact_issue.png?dl=0Thanks.

nivida_contact_issue.png1051×409 96.3 KB
Hello,Thanks for reaching out. I am looking into this now. I will get back to you, or have someone from the Drive team reply to you here in the thread.Best,
TomHello,What symptoms are you seeing when you try to submit the form, besides the errors that show in the inspector?FredHi Fred,There is no symptoms, like as in there are no feedback when the form is filled out and submit is pressed. If the form is filled out incorrectly (empty fields etc.) there is correct feedback with “This field is required” - but that looks like it’s javascript and not through REST. The console throws the error the first time I press submit, after that there is nothing.I have tried different external IPs, Safari and Chrome on MacOS and Firefox on Linux on a few different machines.Is it working on your end?Thanks,Hi Fred,Still nothing? Is there another way to get in touch with the self-driving team? Just a plain email address or something?The person who can investigate was out until today. I’ll ping her again.FredPowered by Discourse, best viewed with JavaScript enabled"
19,restart-course-course-progress,"I have paid for the class named ‘Introduction To Deep Learning’ and recently I have been busy out of town. Is there a way to restart course or add more time? I would really like to start at lab 1 again but I do not have the time allocated for the lab.Also how to you know that you are making progress in the course?Hello,I just granted you an additional four hours. Let me know if you have trouble accessing the course.Regarding the course progress, if it is a graded course there is a progress link near the top of the screen.Cheers,
TomWhen I try to start the video the video will not start. Is that a problem with the program or is that a problem with the course itselfnever mind it was a problem with my computerPowered by Discourse, best viewed with JavaScript enabled"
20,the-forum-frequently-blocks-me-from-posting-topics-with-clear-titles-that-are-complete-sentences,"I am trying to post a new topic with the titleIs an eventfd a valid cudaExternalSemaphoreHandleTypeOpaqueFd?but the title moderator is blocking me from posting.  This is a frequent problem.  Satisfying the title modbot  is a mysterious and frustrating process.Is there any way to work around the title moderator?Hello @cory.bloyd,What is the error that you are seeing? Have you tried posting with a shorter title?Title seems unclear, is it a complete sentence?I suggest removing “cudaExternalSemaphoreHandleTypeOpaqueFd” from the title and only include it in the post.Is an eventfd a valid external semaphore?worked.It is very frustrating to go through this process every time I try to post.  The APIs we are discussing are full of names like cudaExternalSemaphoreHandleTypeOpaqueFd.  The forum should not be confused by them.The issue is the maximum allowed word length in a topic title is 30 characters.
I bumped this to 50. Let me know if you still experience issues.Best,
TomThat is greatly appreciated!  Much thanks!Powered by Discourse, best viewed with JavaScript enabled"
21,cant-login-to-deep-learning-institute,"I cannot log in to the deep learning institute for a course that I purchased. Seems this has been an issue in the past.When I try to log into my course Fundamentals of Accelerated Computing with CUDA C/C++, a username/password dialog pops up:""Sign in to access this siteAuthorization required by https://courses.nvidia.comUsername:
Password:""I can sign into with my username /password to manage my NVIDIA account at NVIDIA Account.Previous Issue with same system:
Can’t login to Deep Learning Institute - Community Information / Forum Feedback - NVIDIA Developer ForumsThanks!JeffI have the same issue and can’t log in.Hi,I have the team looking into this issue now. Thanks for your patience.Tom KI was able to log in successfully. I didn’t do anything different. Thanks for getting it back up!!Great! Thanks for letting us know.Hi, i have the same problem, how did you resolve it? im going crazy over hereHi @pierinisantiago2,Are you still having issues with your login? If so, what error are you seeing?Thanks,
TomHi TomK,
it happens when i try to enroll in a course, it takes me to a page that it says
“You have successfully signed into NVIDIA, but your NVIDIA account does not have a linked NVIDIA account. To link your accounts, sign in now using your NVIDIA password”
and when i try to login this happens
""#### We couldn’t sign you in.its been way more than 30 min and i cant login, please help me, i really want to take the course@pierinisantiago2,I have the team looking into your issue now. Thanks for your patience.Thank you Tom!
Is there a way i can access the courses in the meanwhile?Unfortunately that is not possible.Hello, I am unable to Log-In my Nvidia Developer Account, I am stuck on the security challenge page, I am not receiving any email , my email   is   "" @icloud.com  "" . I have no mails, neither any spam !! This account is very important for me !!@ish100.ishan,How are you posting here in the forums if you cannot log in? Are you referring to the DLI login? Please provide a screenshot of the login page you are using.Thanks,
Tom@TomNVIDIA  I had to make a new Account !! I have had access to the Nvidia Developer account since Jan 2020 !! My email id ends at @icloud.com !! I am not able to receive any mail for security verification !! All my data for that account is very important for me !   that email is  ishanbhatnagar****@icloud.com !!I am not finding your account. Can you please private message me the exact user name and email address used?Are you able to log into your DLI account now?Hi Tom, i just tried and still i cant access, it says the samething as before:
""#### We couldn’t sign you in.Hi @pierinisantiago2,Sorry to hear. I have escalated your issue to the DLI team. I don’t have an ETA for you, but will be sure to let you know when this has been resolved.Best regards,
Tom@pierinisantiago2,You should have received an email from the DLI team. Let me know if you have any questions.Thanks,
TomHi Tom, I finally resolve the issue, it seems that it was missing a step in my Nvidia account configuration, after doing that I was able to access the deep learning institute with no problem.Thank you so much for your help.
SantiagoPowered by Discourse, best viewed with JavaScript enabled"
22,incorrect-email-or-password,"I read this topic from a year ago https://devtalk.nvidia.com/default/topic/1057977/forum-feedback/unable-to-login-through-sdk-manager/
and I have the exact same thing. Reset my password 3x, unblocked 3x. Tried to connect from 3 different IPs. Nothing works. How is this still so bad when it was known a year ago?Hello,I have our engineers looking into your account. I will update here when i have info.
Thanks for your patience.Best,
TomI am also having login issues.I am only logged in because I chose create new account and it then knew who I am and logged me in.I can live without the forums. I need SDK manager.
I am moving from a dev kit to a new module on a small carrier board as a sales prototype.  I need to configure it but I can’t get into sdkmanager.On linux box I cleared cookies and browser history.  I was able to make a new account but still couldn’t get into sdkmanager.I need help soon.Teitel, you can temporarily get past it by switching ips. Try your phone network. You just need to get past the login screen, after that you can switch backTeitel, you can temporarily get past it by switching ips. Try your phone network. You just need to get past the login screen, after that you can switch backthe phone network didn’t work.  I hope I don’t have to go to Starbucks.
or NVIDIA headquarters is 2 miles away.  their lobby network might work…or where can i download the R3.2.1 image from so I can work offline.@CC.L . You should be good to go now.@Teitel, We are looking into your account. Please stand by.Thanks,
TomThanks for the quick help @TomK@NvidiaPowered by Discourse, best viewed with JavaScript enabled"
23,where-can-we-post-issues-with-documentation,"If there are issues with any NVIDIA produced documentation what is the appropriate channel?
I’m working my way through various README etc files from L4T-README that came with the Xavier but from what I can tell this isnt an Xavier specific issue.
Thanks!The Xavier forum is here:
[url]https://devtalk.nvidia.com/default/board/326/jetson-agx-xavier/[/url]
(which covers L4T on the Xavier)The subset of various Jetsons are here (and the above Xavier URL is part of this):
[url]https://devtalk.nvidia.com/default/board/139/embedded-systems/[/url]Powered by Discourse, best viewed with JavaScript enabled"
24,how-to-change-the-nvidia-web-password,"Was informed by Google that this site has been hacked and user information has been stolen, so I wanted to change my password, but I am unable to figure out how to do this either for the forum here or for the whole https://developer.nvidia.com/ web site. The way the profile editing GUI is designed is really the worst of all sites I am on, and I am  on a lot of sites.Hi Johann,Sorry for the confusion, please visit this page to update your password.
https://www.nvidia.com/en-us/account/edit-profile/We are currently working to improve the PW reset process.Best,
Tom KUpdate: The website has been improved to make changing passwords easier.
The “Change password” link can be found on the user profile page: My Profile | NVIDIA DeveloperPowered by Discourse, best viewed with JavaScript enabled"
25,page-not-found-jetson-linux-release-notes-r35-2-1-pdf,"Hi,
In Release Notes :: NVIDIA JetPack Documentation the link to Jetson Linux release notes is broken.Hi @Gorgo90,Thanks for reaching out with this info. I have the team looking into this now. I will let you know when this has been fixed.Best,
TomHi @Gorgo90,I am happy to report that this is now fixed.Release Notes :: NVIDIA JetPack Documentation237.92 KBThis topic was automatically closed 14 days after the last reply. New replies are no longer allowed.Powered by Discourse, best viewed with JavaScript enabled"
